{
  "$schema": "https://json-schema.org/draft/2020-12/schema",
  "$id": "https://dumbhome.org/schema/device.schema.json",
  "title": "Device record",
  "type": "object",
  "required": ["model_id","make","model","category","tier","status","the_unplug_test","sources","last_verified"],
  "additionalProperties": false,
  "properties": {
    "model_id":   {"type":"string","pattern":"^[a-z0-9]+(-[a-z0-9]+)*$","description":"slug, make-model, stable forever"},
    "make":       {"type":"string"},
    "model":      {"type":"string","description":"exact enough to buy, unless record_type is 'family'"},
    "record_type":{"enum":["device","family"],"default":"device",
      "description":"'family' covers a product line where the manufacturer mixes connected and non-connected SKUs and churns model numbers faster than we can track. A family record tells the reader how to identify the non-connected variant themselves rather than naming a SKU that will be stale in six months."},
    "identify":   {"type":["string","null"],
      "description":"family records only: how to tell the non-connected variant apart on a spec sheet or shelf tag"},
    "known_dumb_models": {"type":"array","items":{"type":"string"},
      "description":"family records only: examples verified at the accessed date. Explicitly non-exhaustive."},
    "category":   {"enum":["kitchen", "laundry", "climate", "lighting", "security", "automotive", "av", "computing", "photo", "health", "baby-pet", "tools", "wearables", "office"],
                   "description":"domain slug; must exist in schema/taxonomy.json"},
    "subcategory":{"type":["string","null"],"description":"must be listed under this domain in schema/taxonomy.json"},

    "tier":       {"enum":["D0","D1","D2","D3","REJECT"]},
    "tier_rationale": {"type":"string","description":"which decision-table row fired, in one sentence"},

    "status":     {"enum":["verified","insufficient_evidence","needs_reverification","rejected","blocked"]},
    "rejection_reason": {"type":["string","null"]},

    "the_unplug_test": {"type":"string","maxLength":600,
      "description":"2-4 plain sentences: what happens when the router is off"},

    "account_required":       {"enum":["none","app_only","for_setup","for_core","unknown"]},
    "works_offline":          {"enum":["fully","partially","no","unknown"]},
    "offline_losses":         {"type":"array","items":{"type":"string"},"description":"what specifically stops working"},
    "firmware_ota_forced":    {"enum":["no","yes","yes_but_blockable","unknown"]},
    "local_api":              {"type":"array","items":{"enum":["none","rest","mqtt","matter","zigbee","zwave","thread","modbus","ble","rs485","ir","unknown"]}},
    "phones_home":            {"enum":["none","telemetry","analytics","heavy","unknown"]},

    "local_replacement":      {"enum":["not_applicable","none","partial","full","unknown"],
      "description":"Can the vendor cloud's function be replaced by hardware the owner runs? not_applicable when no vendor cloud exists (D0/D1). This is deliberately NOT a tier input — the tier describes the product, this describes what a motivated owner can achieve."},
    "local_replacement_note": {"type":["string","null"],
      "description":"Name the actual software or hardware: Frigate, Blue Iris, Home Assistant, ESPHome, ratgdo, weewx."},

    "radios":     {"type":"array","items":{"enum":["none","wifi","ble","zigbee","zwave","thread","cellular","lora","ant_plus","nfc","rfid_lf","dect","proprietary_subghz","proprietary_24ghz",
                        "mmwave","two_way_radio","ir","unknown"],
                   "description":"ble = Bluetooth of ANY flavour - Low Energy, Classic/BR-EDR, or both. The distinction is deliberately not modelled: this catalog exists to answer who can reach your data, and a device whose only radio is Bluetooth cannot reach its maker under either profile. Agents keep writing 'Bluetooth classic' in a source line while tagging ble - that is correct, do that rather than proposing a new enum value; dect = 1920-1930 MHz cordless-phone band; proprietary_subghz = a vendor-specific 433/868/915 MHz point-to-point link, common in weather stations and thermometer probes; mmwave = a 24 or 60-64 GHz millimetre-wave presence-detection radar, the sensing element in modern presence sensors (Aqara FP2/FP3 and similar). It is an intentional radiator and needs a grant, but it talks to nothing - it reflects off people in the room - so unlike every other value here it says nothing about who can receive your data, and its presence must never be read as a way home. Tag it alongside the radio that actually carries the data; proprietary_24ghz = a vendor-specific 2.4 GHz FHSS point-to-point link that is not 802.11 or Bluetooth, common in analogue-replacement baby monitors and wireless doorbells; nfc = 13.56 MHz near-field; rfid_lf = a 125-134 kHz low-frequency reader, the ISO 11784/11785 band used by pet microchips and access fobs, which is short-range and receive-dominant; ant_plus = the ANT+ 2.4 GHz sport-sensor protocol, an open published standard that heart-rate straps, cadence and power sensors broadcast to ANY compatible watch or app with no pairing to a vendor; tag it alongside ble where a sensor broadcasts both, because the two say different things about who can receive the data; two_way_radio = a licensed or rule-authorised personal voice transceiver (CB, FRS, GMRS, marine VHF, amateur), certified under FCC Part 95 or Part 80 rather than Part 15. An intentional-radiator grant is EXPECTED for these and is not evidence of a cloud — the sibling-control heuristic does not apply; ir = infrared, which is not a radio and does not need an FCC intentional-radiator grant"}},
    "fcc_id":     {"type":["string","null"]},
    "fcc_checked":{"type":"boolean"},

    "liberation": {"type":["object","null"],"additionalProperties":false,
      "properties":{
        "method":{"type":"string","description":"e.g. ESPHome flash via UART"},
        "difficulty":{"enum":["software","disassembly","soldering"]},
        "reversible":{"type":"boolean"},
        "maintained":{"type":"boolean"},
        "guide_url":{"type":"string"}
      }},

    "repairability": {"type":"object","additionalProperties":false,
      "properties":{
        "parts_available":{"enum":["yes","limited","no","unknown"]},
        "ifixit_score":{"type":["number","null"]},
        "notes":{"type":["string","null"]}
      }},

    "availability": {"enum":["in_stock","limited","discontinued","unknown"]},
    "price_band":   {"type":["string","null"],"description":"e.g. $150-200"},
    "price_observed":{"type":["string","null"],"format":"date"},
    "where_to_buy": {"type":"array","items":{"type":"object","required":["name","url"],
      "properties":{"name":{"type":"string"},"url":{"type":"string"}},"additionalProperties":false}},
    "affiliate":    {"type":["object","null"],"description":"human-filled only; agents must leave null"},

    "vendor_risk":  {"type":["integer","null"],"minimum":0,"maximum":3},

    "sources": {"type":"array","minItems":1,"items":{
      "type":"object","required":["url","class","accessed","supports"],"additionalProperties":false,
      "properties":{
        "url":{"type":"string"},
        "class":{"enum":["A","B","C"]},
        "accessed":{"type":"string","format":"date"},
        "supports":{"type":"string","description":"which claim this backs"},
        "archive_url":{"type":["string","null"]}
      }}},

    "alternatives": {"type":"array","description":"Other records worth considering instead. Required on rejections.",
      "items":{"type":"object","required":["model_id","why"],"additionalProperties":false,
        "properties":{"model_id":{"type":"string"},"why":{"type":"string"}}}},

    "open_questions": {"type":"array","items":{"type":"string"}},
    "conflicts_with": {"type":["string","null"]},
    "notes":          {"type":["string","null"]},

    "first_published": {"type":"string","format":"date"},
    "last_verified":   {"type":"string","format":"date"},
    "changelog": {"type":"array","items":{
      "type":"object","required":["date","change"],"additionalProperties":false,
      "properties":{"date":{"type":"string","format":"date"},"change":{"type":"string"},
                    "kind":{"enum":["listed","tier_change","vendor_incident","availability","correction"],
                            "description":"'listed' is routine; everything else is material and leads the /changed feed"},
                    "source":{"type":["string","null"]}}}},

    "agent_meta": {"type":"object","additionalProperties":true,
      "description":"model, prompt version, run id, search count — for the critic loop"}
  }
}
