{
  "model_id": "viofo-a119-v3",
  "make": "VIOFO",
  "model": "A119 V3",
  "category": "automotive",
  "subcategory": "dashcam",
  "tier": "D0",
  "tier_rationale": "No intentional-radiator FCC grant exists for this model while VIOFO holds grants for every sibling model that has a radio, and the manufacturer spec table states Wi-Fi and Bluetooth are not supported.",
  "status": "verified",
  "rejection_reason": null,
  "the_unplug_test": "Nothing changes, because there is nothing to unplug. The camera has no Wi-Fi and no Bluetooth, so there is no app, no account, and no pairing step. You put a microSD card in, plug it into 12V, and it records in a loop. Everything is configured on the 2-inch screen with four buttons.",
  "account_required": "none",
  "works_offline": "fully",
  "offline_losses": [],
  "firmware_ota_forced": "no",
  "local_api": [
    "none"
  ],
  "phones_home": "none",
  "radios": [
    "none"
  ],
  "fcc_id": null,
  "fcc_checked": true,
  "liberation": null,
  "repairability": {
    "parts_available": "unknown",
    "ifixit_score": null,
    "notes": "Capacitor-based rather than battery-based, which removes the usual dashcam failure mode of a swollen lithium cell."
  },
  "availability": "in_stock",
  "price_band": "$120-150",
  "price_observed": "2026-09-01",
  "where_to_buy": [
    {
      "name": "VIOFO (manufacturer)",
      "url": "https://www.viofo.com/products/a119-v3-with-gps-2k-25601600p-30fps-quad-hd-car-dash-cam"
    }
  ],
  "affiliate": null,
  "vendor_risk": 0,
  "sources": [
    {
      "url": "https://www.viofo.com/products/a119-v3-with-gps-2k-25601600p-30fps-quad-hd-car-dash-cam",
      "class": "A",
      "accessed": "2026-09-01",
      "supports": "Manufacturer specification table states 'Wi-Fi: Not supported' and 'Bluetooth: Not supported'. GPS logger built in. Listed at $139.99.",
      "archive_url": null
    },
    {
      "url": "https://fccid.io/search.php?q=VIOFO",
      "class": "A",
      "accessed": "2026-09-01",
      "supports": "No intentional-radiator grant for the A119 V3. VIOFO holds grants for WR1 (2AMBWWR1), VS1 (2AMBWVS1) and A139 (2AMBWA139), all covering Wi-Fi or Bluetooth \u2014 so the absence of a grant for this model is meaningful rather than an unfiled gap.",
      "archive_url": null
    },
    {
      "url": "https://www.viofo.com/blogs/viofo-car-dash-camera-guide-faq-and-news/viofo-firmware-update-guide-step-by-step",
      "class": "A",
      "accessed": "2026-09-01",
      "supports": "Firmware is updated by copying a .bin file to the root of the microSD card and power-cycling the camera. There is no over-the-air path, so the vendor cannot change this device's behaviour after purchase.",
      "archive_url": null
    }
  ],
  "open_questions": [],
  "conflicts_with": null,
  "notes": "The reference case for D0 in this catalog: a mainstream, currently-sold consumer device with no radio at all. Sibling models in the same product line do have Wi-Fi, so this is a deliberate product decision rather than an old design.",
  "first_published": "2026-09-01",
  "last_verified": "2026-09-01",
  "changelog": [
    {
      "date": "2026-09-01",
      "change": "First published at D0.",
      "source": null,
      "kind": "listed"
    }
  ],
  "agent_meta": {
    "model": "claude-opus-5",
    "prompt_version": "phase-0-manual",
    "run_id": "2026-09-01-phase0",
    "searches": 4
  }
}